{
  "status_summary": {
    "completeness": 1.0,
    "confidence": "high",
    "doc_state": "active"
  },
  "gate_progress": [
    { "gate_id": "harvest_gate", "status": "green", "notes": "ok" },
    { "gate_id": "registry_gate", "status": "green", "notes": "ok" },
    { "gate_id": "manifest_gate", "status": "green", "notes": "ok" },
    { "gate_id": "verification_gate", "status": "green", "notes": "ok" },
    { "gate_id": "state_gate", "status": "green", "notes": "ok" },
    { "gate_id": "health_gate", "status": "green", "notes": "ok" },
    { "gate_id": "promotion_gate", "status": "amber", "notes": "pending repo" }
  ],
  "promotion_criteria": [
    "validator passes"
  ],
  "blocked_by": [
    "standalone repo not yet initialized"
  ],
  "next_iteration": {
    "owner": "codex",
    "objective": "promote to standalone repo"
  }
}
